{
  "protocol_version": "0.1",
  "evidence_channels": ["runtime", "agent"],
  "run_id": "android-app-test-001",
  "status": "pass",
  "android": {
    "project_root": "/workspace/android-app",
    "app_copy": "/workspace/out/android-app-test-001/app-copy",
    "source_file": "app/src/main/res/values/strings.xml",
    "source_files": ["app/src/main/res/values/strings.xml"],
    "target_locale": "zh-CN",
    "target_file": "app/src/main/res/values-zh-rCN/strings.xml",
    "target_files": ["app/src/main/res/values-zh-rCN/strings.xml"],
    "adapter": "core.android-strings"
  },
  "generation": {
    "mode": "generated_segments",
    "provider": "codex",
    "providers": ["codex"],
    "quality_claim": "fixture_human_readable_chinese_draft",
    "quality_claims": ["fixture_human_readable_chinese_draft"],
    "generated_segment_count": 10,
    "purpose": "full_android_app_engineering_test"
  },
  "source_preservation": {
    "source_file_before": {
      "exists": true,
      "sha256": "aaaaaaaaaaaaaaaaaaaaaaaaaaaaaaaaaaaaaaaaaaaaaaaaaaaaaaaaaaaaaaaa",
      "size_bytes": 100
    },
    "source_file_after": {
      "exists": true,
      "sha256": "aaaaaaaaaaaaaaaaaaaaaaaaaaaaaaaaaaaaaaaaaaaaaaaaaaaaaaaaaaaaaaaa",
      "size_bytes": 100
    },
    "target_file_before": {
      "exists": false,
      "sha256": null
    },
    "target_file_after": {
      "exists": false,
      "sha256": null
    },
    "original_project_mutated": false
  },
  "summary": {
    "segment_count": 10,
    "batch_count": 1,
    "output_count": 1,
    "agent_status": "draft_package_created",
    "delivery_decision_status": "owner_review_required",
    "real_generation_required": true,
    "real_generation_satisfied": true,
    "apply_created": 1,
    "apply_replaced": 0,
    "localized_file_count": 1,
    "post_apply_qa_status": "pass",
    "post_apply_blocking_count": 0,
    "post_apply_warning_count": 0
  },
  "artifacts": {
    "test_directory": "/workspace/out/android-app-test-001",
    "app_copy": "/workspace/out/android-app-test-001/app-copy",
    "agent_summary": "/workspace/out/android-app-test-001/agent/android-app-test-001-agent/agent-summary.json",
    "generated_segments": "/workspace/out/android-app-test-001/agent/android-app-test-001-agent/generated.jsonl",
    "delivery_decision": "/workspace/out/android-app-test-001/agent/android-app-test-001-agent/delivery-decision.json",
    "apply_result": "/workspace/out/android-app-test-001/apply-result.json",
    "post_apply_qa": "/workspace/out/android-app-test-001/post-apply-android-qa.json",
    "android_app_test_report": "/workspace/out/android-app-test-001/android-app-test-report.json"
  },
  "next_actions": [
    "Inspect the localized app copy and delivery decision report.",
    "Use a real LLM/provider generated output before making translation quality claims."
  ]
}
